AAPL,time
2 Top Stocks to Buy Before 2021 Is Over,2021-12-08 01:07:09 PM
Morgan Stanley Predicts Apple’s Stock Price Will Hit $200 Soon,2021-12-08 01:07:09 PM
Apple Could Be the ‘Catalyst’ for VR Adoption. Morgan Stanley Boosts Price Target.,2021-12-08 01:07:09 PM
Twitter’s New CEO Agrawal Got Early Nod From Dorsey a Year Ago,2021-12-08 01:07:09 PM
Meta Reorganizes Research Department Amid Scrutiny Over Findings,2021-12-08 01:07:09 PM
Apple's alleged restriction on workers' Slack use sparks labor complaint,2021-12-08 01:07:09 PM
Why Apple Stock Climbed to a New All-Time High Today,2021-12-08 01:07:09 PM
Snap is already delivering on the future Meta is promising,2021-12-08 01:07:09 PM
Apple's iPhone 13 production fell 20% in Sept-Oct - Nikkei,2021-12-08 01:07:09 PM
A leader of the #AppleToo movement accused Apple of cracking down on employees' use of Slack to organize,2021-12-08 01:07:09 PM
"Apple hit by supply crunch, saw iPhone 13 production drop 20% in recent months: report",2021-12-08 01:07:09 PM
"Apple, Amazon, Pfizer, Omicron and Tech Stocks - Five Things You Must Know",2021-12-08 01:07:09 PM
"Apple Stock Extends Gains, With $3 Trillion Value in Sight, As Nikkei Reports iPhone Production Slump",2021-12-08 01:07:09 PM
"An ESG Fund Changes the World, One Company at a Time",2021-12-08 01:07:09 PM
2 Big Data Center Acquisitions and What Investors Need to Know,2021-12-08 01:07:09 PM
Why Apple will now let you fix your iPhone,2021-12-08 01:07:09 PM
"Dow Jones Futures Rise On Omicron Vaccine News: Google, Microsoft In Buy Range; Tesla China Sales Strong",2021-12-08 01:07:09 PM
The Metaverse Is Going to Be Bigger Than You Think,2021-12-08 01:07:09 PM
Apple Stock Rises Despite Report of iPhone 13 Production Shortfall,2021-12-08 01:07:09 PM
"How are tech giants like Tesla, Apple, Oracle affecting housing prices in Austin?",2021-12-08 01:07:09 PM
10 Large-Cap Stocks to Buy According to Claes Fornell’s CSat Investment,2021-12-08 01:07:09 PM
"Dow Jones Rallies On Pfizer Vaccine News; Apple Hits New High, Tesla Falls Despite Strong China Sales",2021-12-08 01:07:09 PM
Apple Nears $3 Trillion in Market Value. Here’s Some Context,2021-12-08 01:07:09 PM
Apple inches closer to $3 trillion market cap,2021-12-08 01:07:09 PM
"Apple Is Working On a Second-Generation AR Headset, Analyst Says",2021-12-08 01:07:09 PM
"Chip-Delivery Wait Times Grow Again, Signaling Shortages Will Drag On",2021-12-08 01:07:09 PM
Why Investors Are Stacking Up Apple Stock Today,2021-12-08 01:07:09 PM
5 Dow Jones Stocks To Buy And Watch In December 2021: Apple Hits New High,2021-12-08 01:07:09 PM
Why Intel is unloading Mobileye,2021-12-08 01:07:09 PM
Apple might be the only company that can take VR and AR headsets mainstream,2021-12-08 01:07:09 PM
